name;area_name;url;salary_from;salary_to;salary_cur;requirement;responsibility;employer;api
Стажер-тестировщик QA;Москва;https://hh.ru/vacancy/86626961;0;0;RUR;Интерес к процессу тестирования и обеспечению качества. Желание развиваться в данной профессиональной области. Базовое понимание основных этапов и принципов тестирования...;Участие в разработке EdTech платформы. Большое количество знаний. Ручное и Авто-тестирование.;HardQode;HH
Стажер-программист Python;Москва;https://hh.ru/vacancy/86400360;0;0;RUR;Базовые знания <highlighttext>Python</highlighttext> (>3).;Принимать участие в разработке EdTech платформы. Делал какие-то pet-проекты.;HardQode;HH
Junior разработчик Python/Django;Москва;https://hh.ru/vacancy/86396944;60000;80000;RUR;Умение писать на <highlighttext>Python</highlighttext> (>3). Знание django/drf. Умение работать с git или другой системой контроля версий. Умение написать Dockerfile...;Принимать участие в разработке EdTech платформы. Участвовать в проектировании новых возможностей наших продуктов.;HardQode;HH
Junior Программист в Технический блок;Алматы;https://hh.ru/vacancy/86680430;0;0;RUR;Высшее образование в сфере IT или телекоммуникаций. Опыт в сфере телекоммуникаций более 2-х лет. Опыт работы с PHP7...;Работа в команде Программистов и выполнение отдельных задач в рамках глобальных проектов. Команда будет заниматься разработкой систем и приложений для...;Beeline, ТМ;HH
Начинающий аналитик данных;Москва;https://hh.ru/vacancy/86559948;35000;;RUR;Образование в профильной или смежной области. Знание <highlighttext>Python</highlighttext>. Стремления к профессиональному развитию.. Опыт работы не обязателен.;Мы помогаем брендам иметь безупречный имидж уже 9 лет. Основные компетенции агентства: репутационный менеджмент (ORM), управление поисковой выдачи (SERM), услуги...;Topface Media;HH
Data Scientist (стажер), удаленно;Москва;https://hh.ru/vacancy/86571284;;15000;RUR;Сильное и стойкое желание развиваться как Data Scientist. Базовые знания <highlighttext>Python</highlighttext>. Базовые знания алгоритмов машинного обучения. Хорошо развитое логическое мышление...;Проводить ad-hoc аналитику (отвечать на вопросы: как, что и почему повлияло на результат в определенный момент времени). ;Дунаев Михаил Алексеевич;HH
Стажер Data Scientist;Алматы;https://hh.ru/vacancy/86556886;0;0;RUR;Опыт работы со стеком: <highlighttext>Python</highlighttext>, Pandas, Numpy, PostgreSQL. - Хорошие коммуникативные навыки.;Работа с DWH. - Техническое сопровождение готовых решений, документирование, отчетность.;Grand era;HH
Выездной инженер;Москва;https://hh.ru/vacancy/86662928;40000;;RUR;3. Навыки программирования приветствуются (предпочтительно C#, С++, <highlighttext>Python</highlighttext>). 4. Опыт работы с настройкой периферийных устройств (Банковский терминал, Фискальный регистратор, Считыватель...;1. Участие в сборе и подготовке данных для разработки решений в сфере искусственного интеллекта по распознаванию объектов. 2. ;Смарт Мил Сервис;HH
Стажер-разработчик;Москва;https://hh.ru/vacancy/86584351;0;0;RUR;Приветствуется опыт Visual Basic, JavaScript, <highlighttext>Python</highlighttext>. Системное и аналитическое мышление, навыки структурирования и планирования своей работы. Грамотность и навыки написания...;Наша команда занимается поддержкой и развитием корпоративной сети передачи данных в центрах обработки данных и на территориях ключевых объектов АО...;РСХБ-Интех;HH
Python developer (Junior/Middle);Санкт-Петербург;https://hh.ru/vacancy/86210494;0;0;RUR;Опыт работы с <highlighttext>Python</highlighttext> 3 - от 2х лет. Знание ООП, архитектурные паттерны. Опыт работы с Flask, Django. ;Работать с внутренней автоматизацией и с внутренними задачами компании. Внедрение сервисов для PM-ов, бухгалтерии, back-офиса. Работа с DWH...;Surf;HH
Frontend-разработчик (удаленно);Тольятти;https://hh.ru/vacancy/86597491;70000;100000;RUR;Опыт серверной разработки (например Nodejs, PHP, <highlighttext>Python</highlighttext>). Опыт работы с Next JS и понимание что такое Server-Side Rendering. ;Разработка и поддержка клиентских приложений с использованием React и Typescript. Верстка и стилизация пользовательского интерфейса. Интеграция с бэкенд-сервисами через...;Juzt Studio;HH
Стажер-программист Python;Москва;https://hh.ru/vacancy/86458967;60000;;RUR;Способность быстро разобраться в неизвестном предмете (протоколе, языке программирования, и т.д.). Опыт программирования на <highlighttext>Python</highlighttext> (не обязательно промышленный). ;Исследования, разработка прототипов программ (на <highlighttext>Python</highlighttext>) в сфере взаимодействия различного оборудования между собой по различным цифровым протоколам, анализ и визуализация...;Автономные беспилотные системы;HH
Python-разработчик;Москва;https://hh.ru/vacancy/85252162;;40000;RUR;Отличные знания <highlighttext>Python</highlighttext> и SQL. Умение писать поддерживаемый и тестируемый код. Умение декомпозировать задачи, оценивать их и выдерживать сроки. ;Разработка и поддержка проектов на django и fastapi. Реализация задач назначаемых архитектором системы. Работа в микросервисной парадигме. Покрытие кода функциональными...;Битапл;HH
Разработчик Python Junior;Воронеж;https://hh.ru/vacancy/86372853;0;0;RUR;Уверенное знание <highlighttext>python</highlighttext>3. Базовые навыки администрирования linux. Опыт работы с одним или нескольким <highlighttext>python</highlighttext> web framework: Django, flask, FastAPI...;Разработка сервисных приложений на языке <highlighttext>python</highlighttext> 3.8+. Реализация интерфейсов по протоколам HTTP/HTTPS. Реализация API. Реализация подключения и...;Нумеди;HH
Программист-стажер;Москва;https://hh.ru/vacancy/86420017;0;0;RUR;Обучение в высшем учебном заведении по специальности программист и/или информационные технологии и/или ИТ и связь. Желание учиться и...;Выполнение заданий, получение консультаций от опытных специалистов. Изучение и практические задания на <highlighttext>Python</highlighttext> JavaScript. Изучение и получения практических навыков работы...;АЛЬФАСАТКОМ;HH
Разработчик Python (junior);Москва;https://hh.ru/vacancy/86324076;;80000;RUR;Знание что такое swagger. Знание как управлять зависимостями в приложениях на <highlighttext>python</highlighttext> (pip/poetry/pipenv). Понимание про typehints/mypy. ;Написание микросервисов для аналитических сервисов (формируют хитрый оптимизированный запрос в БД, обрабатывает на <highlighttext>python</highlighttext> и отдает в <highlighttext>python</highlighttext>). ;ANABAR;HH
Middle QA Engineer;Москва;https://hh.ru/vacancy/86671817;120000;;RUR;Опыт разработки тест-планов, тест-кейсов. Знание <highlighttext>Python</highlighttext>, опыт автоматизации тестирования (как плюс). Базовые знания html, сss, regexp. ;Функциональное тестирование мобильных и web приложений. Тестирование API. Сопровождение задач, мониторинг качества продукта. Документирование багов. Проверка кейсов перед релизом, тестирование...;Level.Travel;HH
Web-программист - стажер;Алматы;https://hh.ru/vacancy/85628220;0;0;RUR;Знать теорию тестирования, что такое тест планы, чек листы и протокол тестирования, свободно владеть ЯП <highlighttext>Python</highlighttext>, быть приспособленным к монотонной...;Как правильно работать с git-ом в команде. Писать автотесты на базе Selenium/<highlighttext>Python</highlighttext> (тестировщик). Создавать web-дизайны для реальных...;Autodata;HH
Стажировка продуктовым аналитиком в команде путешествий;Москва;https://hh.ru/vacancy/85967938;;60000;RUR;Любовь к цифрам и табличкам. Знание SQL и <highlighttext>Python</highlighttext> хотя бы на базовом уровне. Умение говорить числами вместо гуманитарных эпитетов. ;Разобраться с нашим инструментарием и данными. Проверять продуктовые гипотезы: участвовать в исследованиях и АБ-тестированиях, анализировать результаты. Прогнозировать показатели компании...;Туту.ру;HH
Frontend;Краснодар;https://hh.ru/vacancy/86687911;70000;81000;RUR;Опыт написания скриптов на <highlighttext>Python</highlighttext> под FrontEnd. Уверенное владение HTML/CSS, JavaScript. Желателен опыт создания одностраничных приложений. Дополнительный плюс знание...;Разрабатывать новые инструменты автоматизации рабочих процессов. Поддерживать и совершенствовать существующие решения по автоматизации.;МТС;HH
Начинающий разработчик Python;Караганда;https://hh.ru/vacancy/86320517;0;0;RUR;Имели базовые знания работы с Linux (терминал). Умели работать с документацией к <highlighttext>Python</highlighttext> библиотекам. Были ответственными и самостоятельными. ;Освоение основ разработки чат-ботов и работы с API мессенджера Telegram. Изучение базовых концепций машинного обучения и глубокого обучения. ;SimpleCode;HH
Junior Python Developer;Екатеринбург;https://hh.ru/vacancy/86410407;40000;;RUR;Знание <highlighttext>Python</highlighttext> 3. Опыт работы с ORM (Django ORM, Peewee). Навыки работы с БД (PostgreSQL, Mongo). Будет плюсом: Навыки разработки...;Создание новых интересных фич. Поддержка текущей функциональности. Написание тестов. Оптимизация сервисов под высокие нагрузки. Стек технологий следующий:;Моушен Лоджик;HH
Junior backend-разработчик;Рязань;https://hh.ru/vacancy/86213456;30000;;RUR;Опыт работы с Go. Пройденный GoTour. Работа с git. Примеры проектов. Опыт создания HTTP-сервисов.;Создавать веб-сервисы, автоматизирующие маркетинг. Работать с высоконагруженными приложениями. Разрабатывать на Go, работать с SQL и NoSQL базами данных.;enKod;HH
Data scientist;Нижний Новгород;https://hh.ru/vacancy/86684667;0;0;RUR;Опыт участия в соревнованиях или других проектах. Уверенное владение Linux. Владение <highlighttext>python</highlighttext> в части анализа данных: pandas, numpy, sklearn, xgboost...;Подготавливать данные для обучения. Исследовать, подбирать и обучать наиболее подходящие алгоритмы ML и DL для решения задач. Проектировать инфраструктуру для...;ГК АГАТ;HH
Cтажер-разработчик Python/C# (Data Engineer);Москва;https://hh.ru/vacancy/86551216;35000;35000;RUR;Базовое знание <highlighttext>Python</highlighttext>, а также статически типизированного языка с ООП (C#, С++, Java и др.), предпочтительно .NET/C#. ;Net6+ везде, многое в k8s. Монолит — не легаси, поддерживаем на актуальном стеке и активно развиваем, 30...;Mindbox;HH
Junior python developer/data engineer;Нижний Новгород;https://hh.ru/vacancy/86316688;40000;80000;RUR;Уверенное знание <highlighttext>Python</highlighttext>, git, опыт работы со Scrapy. Знание ООП, Linux, умение разбираться в чужом коде. Нацеленность на результат, внимательность...;Разработка парсеров сайтов, участие в развитии продуктов компании.;IT-компания Lad;HH
Python-разработчик;Москва;https://hh.ru/vacancy/86685568;0;0;RUR;Будет плюсом умение писать автотесты, умение работать с асинхронным <highlighttext>python</highlighttext>, опыт работы с FastAPI, RabbitMQ, PostgreSQL, Docker. От кандидата ждем...;Улучшение, доработка существующего функционала магазина, развитие сервисов (оплата, доставка, работа склада) и инфраструктуры в целом.;Карнаухов Дмитрий Александрович;HH
Fullstack разработчик (стажировка);Москва;https://hh.ru/vacancy/86470982;20000;20000;RUR;Проект работает в режиме тестирования, требуется full-stack стажёр, кто смог бы обеспечивать работоспособность проекта. Есть возможность разобраться в хорошем...;Поддерживать работоспособность ресурса. Чинить баги на бэке (в основном) и на фронте (иногда). Back-end: <highlighttext>Python</highlighttext> - Django.;Инвентик;HH
Стажер-разработчик Python;Москва;https://hh.ru/vacancy/84826929;0;0;RUR;Аналитический склад ума, быстрая обучаемость. Знание <highlighttext>Python</highlighttext>, SQL на уровне выборок данных из нескольких таблиц \ insert \ update, хорошие знания Excel...;Обучение профессии Разработчик <highlighttext>Python</highlighttext> в проектах под руководством наставника по индивидуальному плану и включение в Программу развития.;TerraLink;HH
Помощник веб разработчика/junior web developer;Великий Новгород;https://hh.ru/vacancy/86415288;30000;;RUR;Много. Технологии: 1. Опыт с другими языками программирования: PHP, <highlighttext>Python</highlighttext>, Java и т.д... 2. Опыт с Linux и в...;Надо будет делать: 1. Участвовать в разработке новых веб-приложений. Делать то, что сможете делать. 2. Вести проекты на поддержке...;Traffic agency;HH
Аналитик (Могилев);Могилев;https://hh.ru/vacancy/86447854;0;0;RUR;Высшее экономическое/техническое/математическое образование. Базовое знание SQL, <highlighttext>Python</highlighttext>. Умение применять на практике различные статистические методы анализа данных: вероятность, причинно...;Исследование пользовательского поведения, игровых трендов и предоставление рекомендаций по улучшению механик игры и оптимизации монетизации. Работа с инструментами аналитики и...;Феномен Геймз;HH
Python разработчик;Санкт-Петербург;https://hh.ru/vacancy/86740754;50000;150000;RUR;Набор навыков и умений: - Знание <highlighttext>Python</highlighttext>. - Опыт создания на <highlighttext>Python</highlighttext> серверной части для мобильных приложений. - Использование git - в нашем случае...;2) Заполнение анкеты.;Центр Программного Обеспечения;HH
Backend-разработчик;Москва;https://hh.ru/vacancy/85934488;75000;;RUR;Основы программирования по языкам (JavaScript, <highlighttext>Python</highlighttext>).;Веб-разработка при помощи (HTML+CSS, Javascript, JS (GameDev), <highlighttext>Python</highlighttext>). ISmart организует группы и учебный процесс, предоставляет программу обучения и образовательный...;Айсмарт;HH
Data Scientist (удаленно) / временные ряды / CV;Новосибирск;https://hh.ru/vacancy/86598606;0;0;RUR;Пунктуальность, систематичность, ответственное отношение к дедлайнам. . Уверенное владения <highlighttext>Python</highlighttext> для ML (преимущественно временные ряды и cv). . Опыт реализации и применения...;Работа с подготовкой и аннотацией данных (датасетов). Подбор, доработка и обучение моделей, подходящих для решения той или иной задачи. ;Data Acquisition;HH
Веб - программист (стажёр / помощник);Иркутск;https://hh.ru/vacancy/86165439;;30000;RUR;Может уделять работе в офисе (в рабочее время – ПН-ПТ в промежутке с 09-00 до 18-00). ;Работа с небольшими проектами по технической поддержке. Верстка и программирование простых модулей для существующих сайтов. Интеграция баз данных сайтов с...;Мир сайтов;HH
IT Analyst Intern / Стажер IT-аналитик;Москва;https://hh.ru/vacancy/86388281;90000;;RUR;Strong analytical skills. A solid understanding of SQL and <highlighttext>Python</highlighttext> at the junior level. Experience with KNIME, PostgreSQL, and Power...;Design a business-oriented, accurate reporting system to discover potential risks and business opportunities. Perform ad hoc analysis to drill...;Procter & Gamble;HH
Junior Backend - разработчик;Самара;https://hh.ru/vacancy/86425845;0;0;RUR;Node.js (Express). ООП и его реализация в TypeScript. Асинхронный JavaScript. Понимание устройства БД и умение строить запросы на SQL (у...;Возможность обоснованно влиять на стратегические планы и используемые технологии (работа с владельцами напрямую). Печенье, чай, пицца и здоровенный ласковый ручной...;НЕОСОФТ;HH
C++ developer (Telecom);Санкт-Петербург;https://hh.ru/vacancy/85423457;0;0;RUR;Знание архитектуры процессора (любого). Знание скриптовых языков (<highlighttext>Python</highlighttext>, Shell, Perl, etc.). Знание цифровой обработки сигналов и опыт работы с Matlab. ;Совместно с командой предстоит разработка решений от этапа исследования и прототипирования до вывода в коммерческое использование. Разработка программного обеспечения для...;YADRO;HH
Backend-разработчик Python;Челябинск;https://hh.ru/vacancy/86559386;0;0;RUR;Опыт разработки web приложений и сервисов на <highlighttext>Python</highlighttext> (Django, FastAPI) и/или желание развиваться в этом направлении. Понимание базовых принципов...;Разработка масштабируемых интеллектуальных сервисов видеоаналитики на основе Nuitrack SDK / Face SDK. Разработка высоконагруженных самообучаемых сервисов обработки данных с использованием проприетарных...;ТРИДИВИ;HH
Junior/Стажер тестировщик (автотестирование);Ижевск;https://hh.ru/vacancy/86386243;0;0;RUR;Понимание основ работы web-приложений. Базовые знания <highlighttext>python</highlighttext> или любого скриптового языка + желание научиться писать на нем лучше. ;Основные рабочие направления и технологический стек: Автоматизация тестирования WEB приложений (PyTest/Selenium). Доработка системы автотестов. Работа с багтрекером, системами хранения...;ГУТАКС;HH
